Intent,Question,Answer
has_bbq,"Is there a barbecue available at Dassen Eiland Home?","Yes"
has_bbq,"Can I use a BBQ at Dassen Eiland Home?","Yes"
has_bbq,"Does Dassen Eiland Home include a BBQ?","Yes"

has_microwave,"Is there a microwave in Dassen Eiland Home?","Yes"
has_microwave,"Does Dassen Eiland Home provide a microwave?","Yes"
has_microwave,"Can I use a microwave at Dassen Eiland Home?","Yes"
has_microwave,"Does Dassen Eiland Home include a microwave?","Yes"

has_hair_dryer,"Is there a hair dryer at Dassen Eiland Home?","Yes"
has_hair_dryer,"Does Dassen Eiland Home provide a hair dryer?","Yes"
has_hair_dryer,"Can I use a hair dryer at Dassen Eiland Home?","Yes"
has_hair_dryer,"Does Dassen Eiland Home include a hair dryer?","Yes"

has_coffee_tea,"Are coffee and tea provided at Dassen Eiland Home?","Yes"
has_coffee_tea,"Does Dassen Eiland Home offer coffee and tea?","Yes"
has_coffee_tea,"Can I get coffee and tea at Dassen Eiland Home?","Yes"
has_coffee_tea,"Is coffee and tea available in Dassen Eiland Home?","Yes"

has_milk,"Is milk provided at Dassen Eiland Home?","Yes"
has_milk,"Does Dassen Eiland Home offer milk?","Yes"
has_milk,"Can I get milk at Dassen Eiland Home?","Yes"
has_milk,"Is milk available in Dassen Eiland Home?","Yes"

has_water,"Is water provided at Dassen Eiland Home?","No"
has_water,"Does Dassen Eiland Home offer bottled water?","No"
has_water,"Can I get water at Dassen Eiland Home?","No"
has_water,"Is water available in Dassen Eiland Home?","No"

has_biscuits,"Are biscuits available at Dassen Eiland Home?","No"
has_biscuits,"Does Dassen Eiland Home provide biscuits?","No"
has_biscuits,"Can I get biscuits at Dassen Eiland Home?","No"
has_biscuits,"Are there biscuits in Dassen Eiland Home?","No"

has_rusk,"Is rusk available at Dassen Eiland Home?","No"
has_rusk,"Does Dassen Eiland Home offer rusk?","No"
has_rusk,"Can I get rusk at Dassen Eiland Home?","No"
has_rusk,"Is rusk provided in Dassen Eiland Home?","No"

has_charcoal_wood,"Are charcoal or wood available at Dassen Eiland Home?","No"
has_charcoal_wood,"Does Dassen Eiland Home provide charcoal or wood?","No"
has_charcoal_wood,"Can I use charcoal or wood at Dassen Eiland Home?","No"
has_charcoal_wood,"Is charcoal or wood available in Dassen Eiland Home?","No"

has_body_wash,"Is body wash provided at Dassen Eiland Home?","Yes"
has_body_wash,"Does Dassen Eiland Home offer body wash?","Yes"
has_body_wash,"Can I get body wash at Dassen Eiland Home?","Yes"
has_body_wash,"Is body wash available in Dassen Eiland Home?","Yes"

checkin_method,"What is the check-in method for Dassen Eiland Home?","In-person check-in"
checkin_method,"How do I check in to Dassen Eiland Home?","With an in-person check-in"
checkin_method,"What is the check-in procedure for Dassen Eiland Home?","In-person assistance"
checkin_method,"How is the check-in handled at Dassen Eiland Home?","Someone will meet you in person"

price_high,"What is the high season price for Dassen Eiland Home from December 1 to January 15?","R5 000"
price_high,"How much does Dassen Eiland Home cost during high season (Dec 1 - Jan 15)?","R5 000"
price_high,"What is the rate for Dassen Eiland Home in high season?","R5 000"
price_high,"Can you tell me the high season pricing for Dassen Eiland Home?","R5 000"

price_mid,"What is the mid season price for Dassen Eiland Home from January 16 to May 15 and October 16 to November 30?","R3 500"
price_mid,"How much does Dassen Eiland Home cost during mid season (Jan 16 - May 15 & Oct 16 - Nov 30)?","R3 500"
price_mid,"What is the rate for Dassen Eiland Home in mid season?","R3 500"
price_mid,"Can you tell me the mid season pricing for Dassen Eiland Home?","R3 500"

price_low,"What is the low season price for Dassen Eiland Home from May 16 to October 15?","R3 000"
price_low,"How much does Dassen Eiland Home cost during low season (May 16 - Oct 15)?","R3 000"
price_low,"What is the rate for Dassen Eiland Home in low season?","R3 000"
price_low,"Can you tell me the low season pricing for Dassen Eiland Home?","R3 000"

min_stay,"What is the minimum stay required at Dassen Eiland Home?","2 nights"
min_stay,"How many nights must I stay at Dassen Eiland Home?","2 nights"
min_stay,"Is there a minimum stay at Dassen Eiland Home?","2 nights"
min_stay,"What is the shortest stay allowed at Dassen Eiland Home?","2 nights"

max_stay,"What is the maximum stay allowed at Dassen Eiland Home?","30 nights"
max_stay,"How long can I stay at Dassen Eiland Home?","30 nights"
max_stay,"Is there a maximum stay duration for Dassen Eiland Home?","30 nights"
max_stay,"What is the longest stay permitted at Dassen Eiland Home?","30 nights"

get_name,"What is the name of the property?","Panorama Seaview Apart"
get_name,"What's the property called?","Panorama Seaview Apart"
get_name,"Can you tell me the name of the apartment?","Panorama Seaview Apart"
get_name,"How is the property named?","Panorama Seaview Apart"

get_address,"What is the address of Panorama Seaview Apart?","Anchor Crescent"
get_address,"Where is Panorama Seaview Apart located?","Anchor Crescent"
get_address,"Can you provide the address for Panorama Seaview Apart?","Anchor Crescent"
get_address,"Where can I find Panorama Seaview Apart?","Anchor Crescent"

get_place,"Where is Panorama Seaview Apart located?","8 Panorama"
get_place,"In which area is Panorama Seaview Apart situated?","8 Panorama"
get_place,"Panorama Seaview Apart is in which place?","8 Panorama"
get_place,"Which locality is Panorama Seaview Apart in?","8 Panorama"

get_type,"What type of property is Panorama Seaview Apart?","Apartment"
get_type,"Is Panorama Seaview Apart a house or an apartment?","Apartment"
get_type,"What kind of accommodation is Panorama Seaview Apart?","Apartment"
get_type,"Can you specify the type of Panorama Seaview Apart?","Apartment"

get_pax,"How many people can Panorama Seaview Apart accommodate?","4"
get_pax,"What is the maximum occupancy of Panorama Seaview Apart?","4"
get_pax,"How many guests can stay at Panorama Seaview Apart?","4"
get_pax,"What is the guest capacity for Panorama Seaview Apart?","4"

get_bedrooms,"How many bedrooms does Panorama Seaview Apart have?","2"
get_bedrooms,"What is the number of bedrooms in Panorama Seaview Apart?","2"
get_bedrooms,"Does Panorama Seaview Apart have multiple bedrooms?","2"
get_bedrooms,"How many bedrooms are there in Panorama Seaview Apart?","2"

get_bathrooms,"How many bathrooms does Panorama Seaview Apart have?","1.5"
get_bathrooms,"What is the number of bathrooms in Panorama Seaview Apart?","1.5"
get_bathrooms,"Does Panorama Seaview Apart have multiple bathrooms?","1.5"
get_bathrooms,"How many baths are available in Panorama Seaview Apart?","1.5"

get_bed_sizes,"What are the bed sizes in Panorama Seaview Apart?","Room 1: 1 King, Room 2: 2 Singles"
get_bed_sizes,"Can you tell me the bed sizes at Panorama Seaview Apart?","Room 1: 1 King, Room 2: 2 Singles"
get_bed_sizes,"What type of beds are in Panorama Seaview Apart?","Room 1: 1 King, Room 2: 2 Singles"
get_bed_sizes,"How big are the beds in Panorama Seaview Apart?","Room 1: 1 King, Room 2: 2 Singles"

get_size,"What is the size of Panorama Seaview Apart?","120m²"
get_size,"How large is Panorama Seaview Apart?","120m²"
get_size,"Can you provide the area of Panorama Seaview Apart?","120m²"
get_size,"What is the total square meters of Panorama Seaview Apart?","120m²"

has_ac,"Does Panorama Seaview Apart have air conditioning?","No"
has_ac,"Is there AC available in Panorama Seaview Apart?","No"
has_ac,"Does Panorama Seaview Apart come with air conditioning?","No"
has_ac,"Can I use air conditioning at Panorama Seaview Apart?","No"

has_heat,"Does Panorama Seaview Apart have heating?","Yes"
has_heat,"Is there heating in Panorama Seaview Apart?","Yes"
has_heat,"Does Panorama Seaview Apart provide heating?","Yes"
has_heat,"Can I expect heating at Panorama Seaview Apart?","Yes"

has_fan,"Does Panorama Seaview Apart have a fan?","No"
has_fan,"Is there a fan available in Panorama Seaview Apart?","No"
has_fan,"Can I use a fan at Panorama Seaview Apart?","No"
has_fan,"Does Panorama Seaview Apart include a fan?","No"

has_washing_machine,"Does Panorama Seaview Apart have a washing machine?","Yes"
has_washing_machine,"Is there a washing machine in Panorama Seaview Apart?","Yes"
has_washing_machine,"Can I do laundry at Panorama Seaview Apart?","Yes"
has_washing_machine,"Does Panorama Seaview Apart provide a washer?","Yes"

has_tumble_dryer,"Does Panorama Seaview Apart have a tumble dryer?","Yes"
has_tumble_dryer,"Is there a dryer available in Panorama Seaview Apart?","Yes"
has_tumble_dryer,"Can I use a tumble dryer at Panorama Seaview Apart?","Yes"
has_tumble_dryer,"Does Panorama Seaview Apart include a dryer?","Yes"

has_dishwasher,"Does Panorama Seaview Apart have a dishwasher?","Yes"
has_dishwasher,"Is there a dishwasher in Panorama Seaview Apart?","Yes"
has_dishwasher,"Can I use a dishwasher at Panorama Seaview Apart?","Yes"
has_dishwasher,"Does Panorama Seaview Apart provide a dishwasher?","Yes"

has_iron,"Is there an iron available at Panorama Seaview Apart?","Yes"
has_iron,"Does Panorama Seaview Apart have an iron?","Yes"
has_iron,"Can I use an iron at Panorama Seaview Apart?","Yes"
has_iron,"Is an iron provided in Panorama Seaview Apart?","Yes"

has_tv,"Does Panorama Seaview Apart have a TV?","Yes"
has_tv,"Is there a television in Panorama Seaview Apart?","Yes"
has_tv,"Can I watch TV at Panorama Seaview Apart?","Yes"
has_tv,"Does Panorama Seaview Apart include a TV?","Yes"

allows_pets,"Are pets allowed at Panorama Seaview Apart?","No"
allows_pets,"Can I bring my pet to Panorama Seaview Apart?","No"
allows_pets,"Is pet-friendly accommodation available at Panorama Seaview Apart?","No"
allows_pets,"Does Panorama Seaview Apart allow animals?","No"

has_desk,"Is there a desk available at Panorama Seaview Apart?","Yes"
has_desk,"Does Panorama Seaview Apart provide a workspace?","Yes"
has_desk,"Can I work at Panorama Seaview Apart?","Yes"
has_desk,"Is a desk included in Panorama Seaview Apart?","Yes"

has_fireplace,"Does Panorama Seaview Apart have a fireplace?","No"
has_fireplace,"Is there a fireplace in Panorama Seaview Apart?","No"
has_fireplace,"Can I use the fireplace at Panorama Seaview Apart?","No"
has_fireplace,"Does Panorama Seaview Apart include a fireplace?","No"

has_fire_extinguisher,"Is there a fire extinguisher at Panorama Seaview Apart?","Yes"
has_fire_extinguisher,"Does Panorama Seaview Apart provide a fire extinguisher?","Yes"
has_fire_extinguisher,"Can I find a fire extinguisher in Panorama Seaview Apart?","Yes"
has_fire_extinguisher,"Is a fire extinguisher available at Panorama Seaview Apart?","Yes"

has_first_aid,"Is there a first aid kit available at Panorama Seaview Apart?","Yes"
has_first_aid,"Does Panorama Seaview Apart provide a first aid kit?","Yes"
has_first_aid,"Can I access a first aid kit in Panorama Seaview Apart?","Yes"
has_first_aid,"Is a first aid kit included in Panorama Seaview Apart?","Yes"

has_bbq,"Does Panorama Seaview Apart have a BBQ?","Yes"
has_bbq,"Is there a barbecue available at Panorama Seaview Apart?","Yes"
has_bbq,"Can I use a BBQ at Panorama Seaview Apart?","Yes"
has_bbq,"Does Panorama Seaview Apart include a BBQ?","Yes"

has_microwave,"Is there a microwave in Panorama Seaview Apart?","Yes"
has_microwave,"Does Panorama Seaview Apart provide a microwave?","Yes"
has_microwave,"Can I use a microwave at Panorama Seaview Apart?","Yes"
has_microwave,"Does Panorama Seaview Apart include a microwave?","Yes"

has_hair_dryer,"Is there a hair dryer at Panorama Seaview Apart?","Yes"
has_hair_dryer,"Does Panorama Seaview Apart provide a hair dryer?","Yes"
has_hair_dryer,"Can I use a hair dryer at Panorama Seaview Apart?","Yes"
has_hair_dryer,"Does Panorama Seaview Apart include a hair dryer?","Yes"

has_coffee_tea,"Are coffee and tea provided at Panorama Seaview Apart?","Yes"
has_coffee_tea,"Does Panorama Seaview Apart offer coffee and tea?","Yes"
has_coffee_tea,"Can I get coffee and tea at Panorama Seaview Apart?","Yes"
has_coffee_tea,"Is coffee and tea available in Panorama Seaview Apart?","Yes"

has_milk,"Is milk provided at Panorama Seaview Apart?","Yes"
has_milk,"Does Panorama Seaview Apart offer milk?","Yes"
has_milk,"Can I get milk at Panorama Seaview Apart?","Yes"
has_milk,"Is milk available in Panorama Seaview Apart?","Yes"

has_water,"Is water provided at Panorama Seaview Apart?","No"
has_water,"Does Panorama Seaview Apart offer bottled water?","No"
has_water,"Can I get water at Panorama Seaview Apart?","No"
has_water,"Is water available in Panorama Seaview Apart?","No"

has_biscuits,"Are biscuits available at Panorama Seaview Apart?","No"
has_biscuits,"Does Panorama Seaview Apart provide biscuits?","No"
has_biscuits,"Can I get biscuits at Panorama Seaview Apart?","No"
has_biscuits,"Are there biscuits in Panorama Seaview Apart?","No"

has_rusk,"Is rusk available at Panorama Seaview Apart?","No"
has_rusk,"Does Panorama Seaview Apart offer rusk?","No"
has_rusk,"Can I get rusk at Panorama Seaview Apart?","No"
has_rusk,"Is rusk provided in Panorama Seaview Apart?","No"

has_charcoal_wood,"Are charcoal or wood available at Panorama Seaview Apart?","No"
has_charcoal_wood,"Does Panorama Seaview Apart provide charcoal or wood?","No"
has_charcoal_wood,"Can I use charcoal or wood at Panorama Seaview Apart?","No"
has_charcoal_wood,"Is charcoal or wood available in Panorama Seaview Apart?","No"

has_body_wash,"Is body wash provided at Panorama Seaview Apart?","Yes"
has_body_wash,"Does Panorama Seaview Apart offer body wash?","Yes"
has_body_wash,"Can I get body wash at Panorama Seaview Apart?","Yes"
has_body_wash,"Is body wash available in Panorama Seaview Apart?","Yes"

checkin_method,"What is the check-in method for Panorama Seaview Apart?","In-person check-in"
checkin_method,"How do I check in to Panorama Seaview Apart?","With an in-person check-in"
checkin_method,"What is the check-in procedure for Panorama Seaview Apart?","In-person assistance"
checkin_method,"How is the check-in handled at Panorama Seaview Apart?","Someone will meet you in person"

price_high,"What is the high season price for Panorama Seaview Apart from December 1 to January 15?","R2 800"
price_high,"How much does Panorama Seaview Apart cost during high season (Dec 1 - Jan 15)?","R2 800"
price_high,"What is the rate for Panorama Seaview Apart in high season?","R2 800"
price_high,"Can you tell me the high season pricing for Panorama Seaview Apart?","R2 800"

price_mid,"What is the mid season price for Panorama Seaview Apart from January 16 to May 15 and October 16 to November 30?","R1 600"
price_mid,"How much does Panorama Seaview Apart cost during mid season (Jan 16 - May 15 & Oct 16 - Nov 30)?","R1 600"
price_mid,"What is the rate for Panorama Seaview Apart in mid season?","R1 600"
price_mid,"Can you tell me the mid season pricing for Panorama Seaview Apart?","R1 600"

price_low,"What is the low season price for Panorama Seaview Apart from May 16 to October 15?","R1 400"
price_low,"How much does Panorama Seaview Apart cost during low season (May 16 - Oct 15)?","R1 400"
price_low,"What is the rate for Panorama Seaview Apart in low season?","R1 400"
price_low,"Can you tell me the low season pricing for Panorama Seaview Apart?","R1 400"

min_stay,"What is the minimum stay required at Panorama Seaview Apart?","2 nights"
min_stay,"How many nights must I stay at Panorama Seaview Apart?","2 nights"
min_stay,"Is there a minimum stay at Panorama Seaview Apart?","2 nights"
min_stay,"What is the shortest stay allowed at Panorama Seaview Apart?","2 nights"

max_stay,"What is the maximum stay allowed at Panorama Seaview Apart?","30 nights"
max_stay,"How long can I stay at Panorama Seaview Apart?","30 nights"
max_stay,"Is there a maximum stay duration for Panorama Seaview Apart?","30 nights"
max_stay,"What is the longest stay permitted at Panorama Seaview Apart?","30 nights"

get_name,"What is the name of the property?","Caz Cottage"
get_name,"What's the property called?","Caz Cottage"
get_name,"Can you tell me the name of the flatlet?","Caz Cottage"
get_name,"How is the property named?","Caz Cottage"

get_address,"What is the address of Caz Cottage?","17 Plettenberg"
get_address,"Where is Caz Cottage located?","17 Plettenberg"
get_address,"Can you provide the address for Caz Cottage?","17 Plettenberg"
get_address,"Where can I find Caz Cottage?","17 Plettenberg"

get_place,"Where is Caz Cottage located?","Caz Cottage"
get_place,"In which area is Caz Cottage situated?","Caz Cottage"
get_place,"Caz Cottage is in which place?","Caz Cottage"
get_place,"Which locality is Caz Cottage in?","Caz Cottage"

get_type,"What type of property is Caz Cottage?","Flatlet"
get_type,"Is Caz Cottage a house or a flatlet?","Flatlet"
get_type,"What kind of accommodation is Caz Cottage?","Flatlet"
get_type,"Can you specify the type of Caz Cottage?","Flatlet"

get_pax,"How many people can Caz Cottage accommodate?","2"
get_pax,"What is the maximum occupancy of Caz Cottage?","2"
get_pax,"How many guests can stay at Caz Cottage?","2"
get_pax,"What is the guest capacity for Caz Cottage?","2"

get_bedrooms,"How many bedrooms does Caz Cottage have?","1"
get_bedrooms,"What is the number of bedrooms in Caz Cottage?","1"
get_bedrooms,"Does Caz Cottage have multiple bedrooms?","1"
get_bedrooms,"How many bedrooms are there in Caz Cottage?","1"

get_bathrooms,"How many bathrooms does Caz Cottage have?","1"
get_bathrooms,"What is the number of bathrooms in Caz Cottage?","1"
get_bathrooms,"Does Caz Cottage have multiple bathrooms?","1"
get_bathrooms,"How many baths are available in Caz Cottage?","1"

get_bed_sizes,"What are the bed sizes in Caz Cottage?","Room 1: 1 Double"
get_bed_sizes,"Can you tell me the bed sizes at Caz Cottage?","Room 1: 1 Double"
get_bed_sizes,"What type of beds are in Caz Cottage?","Room 1: 1 Double"
get_bed_sizes,"How big are the beds in Caz Cottage?","Room 1: 1 Double"

get_size,"What is the size of Caz Cottage?","35m²"
get_size,"How large is Caz Cottage?","35m²"
get_size,"Can you provide the area of Caz Cottage?","35m²"
get_size,"What is the total square meters of Caz Cottage?","35m²"

get_built_year,"When was Caz Cottage built?","1961"
get_built_year,"In which year was Caz Cottage constructed?","1961"
get_built_year,"What is the construction year of Caz Cottage?","1961"
get_built_year,"When did they build Caz Cottage?","1961"

has_ac,"Does Caz Cottage have air conditioning?","No"
has_ac,"Is there AC available in Caz Cottage?","No"
has_ac,"Does Caz Cottage come with air conditioning?","No"
has_ac,"Can I use air conditioning at Caz Cottage?","No"

has_heat,"Does Caz Cottage have heating?","Yes"
has_heat,"Is there heating in Caz Cottage?","Yes"
has_heat,"Does Caz Cottage provide heating?","Yes"
has_heat,"Can I expect heating at Caz Cottage?","Yes"

has_fan,"Does Caz Cottage have a fan?","No"
has_fan,"Is there a fan available in Caz Cottage?","No"
has_fan,"Can I use a fan at Caz Cottage?","No"
has_fan,"Does Caz Cottage include a fan?","No"

has_washing_machine,"Does Caz Cottage have a washing machine?","Yes"
has_washing_machine,"Is there a washing machine in Caz Cottage?","Yes"
has_washing_machine,"Can I do laundry at Caz Cottage?","Yes"
has_washing_machine,"Does Caz Cottage provide a washer?","Yes"

has_tumble_dryer,"Does Caz Cottage have a tumble dryer?","No"
has_tumble_dryer,"Is there a dryer available in Caz Cottage?","No"
has_tumble_dryer,"Can I use a tumble dryer at Caz Cottage?","No"
has_tumble_dryer,"Does Caz Cottage include a dryer?","No"

has_dishwasher,"Does Caz Cottage have a dishwasher?","No"
has_dishwasher,"Is there a dishwasher in Caz Cottage?","No"
has_dishwasher,"Can I use a dishwasher at Caz Cottage?","No"
has_dishwasher,"Does Caz Cottage provide a dishwasher?","No"

has_iron,"Is there an iron available at Caz Cottage?","Yes"
has_iron,"Does Caz Cottage have an iron?","Yes"
has_iron,"Can I use an iron at Caz Cottage?","Yes"
has_iron,"Is an iron provided in Caz Cottage?","Yes"

has_tv,"Does Caz Cottage have a TV?","Yes"
has_tv,"Is there a television in Caz Cottage?","Yes"
has_tv,"Can I watch TV at Caz Cottage?","Yes"
has_tv,"Does Caz Cottage include a TV?","Yes"

allows_pets,"Are pets allowed at Caz Cottage?","No"
allows_pets,"Can I bring my pet to Caz Cottage?","No"
allows_pets,"Is pet-friendly accommodation available at Caz Cottage?","No"
allows_pets,"Does Caz Cottage allow animals?","No"

has_desk,"Is there a desk available at Caz Cottage?","No"
has_desk,"Does Caz Cottage provide a workspace?","No"
has_desk,"Can I work at Caz Cottage?","No"
has_desk,"Is a desk included in Caz Cottage?","No"

has_fireplace,"Does Caz Cottage have a fireplace?","No"
has_fireplace,"Is there a fireplace in Caz Cottage?","No"
has_fireplace,"Can I use the fireplace at Caz Cottage?","No"
has_fireplace,"Does Caz Cottage include a fireplace?","No"

has_fire_extinguisher,"Is there a fire extinguisher at Caz Cottage?","Yes"
has_fire_extinguisher,"Does Caz Cottage provide a fire extinguisher?","Yes"
has_fire_extinguisher,"Can I find a fire extinguisher in Caz Cottage?","Yes"
has_fire_extinguisher,"Is a fire extinguisher available at Caz Cottage?","Yes"

has_first_aid,"Is there a first aid kit available at Caz Cottage?","Yes"
has_first_aid,"Does Caz Cottage provide a first aid kit?","Yes"
has_first_aid,"Can I access a first aid kit in Caz Cottage?","Yes"
has_first_aid,"Is a first aid kit included in Caz Cottage?","Yes"

has_bbq,"Does Caz Cottage have a BBQ?","No"
has_bbq,"Is there a barbecue available at Caz Cottage?","No"
has_bbq,"Can I use a BBQ at Caz Cottage?","No"
has_bbq,"Does Caz Cottage include a BBQ?","No"

has_microwave,"Is there a microwave in Caz Cottage?","Yes"
has_microwave,"Does Caz Cottage provide a microwave?","Yes"
has_microwave,"Can I use a microwave at Caz Cottage?","Yes"
has_microwave,"Does Caz Cottage include a microwave?","Yes"

has_hair_dryer,"Is there a hair dryer at Caz Cottage?","Yes"
has_hair_dryer,"Does Caz Cottage provide a hair dryer?","Yes"
has_hair_dryer,"Can I use a hair dryer at Caz Cottage?","Yes"
has_hair_dryer,"Does Caz Cottage include a hair dryer?","Yes"

has_coffee_tea,"Are coffee and tea provided at Caz Cottage?","Yes"
has_coffee_tea,"Does Caz Cottage offer coffee and tea?","Yes"
has_coffee_tea,"Can I get coffee and tea at Caz Cottage?","Yes"
has_coffee_tea,"Is coffee and tea available in Caz Cottage?","Yes"

has_milk,"Is milk provided at Caz Cottage?","Yes"
has_milk,"Does Caz Cottage offer milk?","Yes"
has_milk,"Can I get milk at Caz Cottage?","Yes"
has_milk,"Is milk available in Caz Cottage?","Yes"

has_water,"Is water provided at Caz Cottage?","No"
has_water,"Does Caz Cottage offer bottled water?","No"
has_water,"Can I get water at Caz Cottage?","No"
has_water,"Is water available in Caz Cottage?","No"

has_biscuits,"Are biscuits available at Caz Cottage?","No"
has_biscuits,"Does Caz Cottage provide biscuits?","No"
has_biscuits,"Can I get biscuits at Caz Cottage?","No"
has_biscuits,"Are there biscuits in Caz Cottage?","No"

has_rusk,"Is rusk available at Caz Cottage?","No"
has_rusk,"Does Caz Cottage offer rusk?","No"
has_rusk,"Can I get rusk at Caz Cottage?","No"
has_rusk,"Is rusk provided in Caz Cottage?","No"

has_charcoal_wood,"Are charcoal or wood available at Caz Cottage?","No"
has_charcoal_wood,"Does Caz Cottage provide charcoal or wood?","No"
has_charcoal_wood,"Can I use charcoal or wood at Caz Cottage?","No"
has_charcoal_wood,"Is charcoal or wood available in Caz Cottage?","No"

has_body_wash,"Is body wash provided at Caz Cottage?","Yes"
has_body_wash,"Does Caz Cottage offer body wash?","Yes"
has_body_wash,"Can I get body wash at Caz Cottage?","Yes"
has_body_wash,"Is body wash available in Caz Cottage?","Yes"

checkin_method,"What is the check-in method for Caz Cottage?","In-person check-in"
checkin_method,"How do I check in to Caz Cottage?","With an in-person check-in"
checkin_method,"What is the check-in procedure for Caz Cottage?","In-person assistance"
checkin_method,"How is the check-in handled at Caz Cottage?","Someone will meet you in person"

price_high,"What is the high season price for Caz Cottage from December 1 to January 15?","R1 500"
price_high,"How much does Caz Cottage cost during high season (Dec 1 - Jan 15)?","R1 500"
price_high,"What is the rate for Caz Cottage in high season?","R1 500"
price_high,"Can you tell me the high season pricing for Caz Cottage?","R1 500"

price_mid,"What is the mid season price for Caz Cottage from January 16 to May 15 and October 16 to November 30?","R1 500"
price_mid,"How much does Caz Cottage cost during mid season (Jan 16 - May 15 & Oct 16 - Nov 30)?","R1 500"
price_mid,"What is the rate for Caz Cottage in mid season?","R1 500"
price_mid,"Can you tell me the mid season pricing for Caz Cottage?","R1 500"

price_low,"What is the low season price for Caz Cottage from May 16 to October 15?","R1 500"
price_low,"How much does Caz Cottage cost during low season (May 16 - Oct 15)?","R1 500"
price_low,"What is the rate for Caz Cottage in low season?","R1 500"
price_low,"Can you tell me the low season pricing for Caz Cottage?","R1 500"

min_stay,"What is the minimum stay required at Caz Cottage?","2 nights"
min_stay,"How many nights must I stay at Caz Cottage?","2 nights"
min_stay,"Is there a minimum stay at Caz Cottage?","2 nights"
min_stay,"What is the shortest stay allowed at Caz Cottage?","2 nights"

max_stay,"What is the maximum stay allowed at Caz Cottage?","30 nights"
max_stay,"How long can I stay at Caz Cottage?","30 nights"
max_stay,"Is there a maximum stay duration for Caz Cottage?","30 nights"
max_stay,"What is the longest stay permitted at Caz Cottage?","30 nights"

get_name,"What is the name of the property?","Proteadale Home"
get_name,"What's the property called?","Proteadale Home"
get_name,"Can you tell me the name of the home?","Proteadale Home"
get_name,"How is the property named?","Proteadale Home"

